link,status,title,description,keywords,error
"https://en.wikipedia.org/wiki/Boyds,_Maryland",success,"Boyds, Maryland - Wikipedia",No description,No keywords,
https://www.boydscoffeestore.com/about-us.html,success,About Boyds Coffee,"Boyds Coffee is that great cup of joe everyone wants and deserves. Founded in Portland, OR in 1900 – we’ve built our brand with a passion for a great cup of coffee.",Boyds | coffee | Portland coffee | Boyds coffee,
https://www.boydsphila.com/,success,Boyds | Shop Women's & Men's Designer Collections,"Explore Boyds for luxury designer & contemporary women's & men's apparel, shoes & accessories. Custom Alterations. Complimentary Parking.",No keywords,
https://www.boydsphila.com/collections/mens-sale,success,Men's Sale | Boyds,"Shop designer & contemporary clothing, sportswear, shoes & accessories for men on sale at Boyds.",No keywords,
https://www.boydsgunstocks.com/,success,Hardwood Gunstock Manufacturer | Boyds Hardwood Gunstocks,"Boyds uses top-grade hardwood to craft durable, long-lasting shotgun & rifle stocks for top-selling firearm brands, including custom options. Get yours today!","gunstock , firearm stocks, shotgun stocks for sale, gunstock, gunstocks, custom wood rifle stocks, shotgun stocks, military stocks, stock finder, aftermarket stocks, pistol stock, wooden stocks, rifle stocks, gun stock, rifle stock ",
"https://www.boydsgunstocks.com/content/resource-center/how-to-and-why-you-would-glass-bed-your-rifle---by-randy-boyd#:~:text=Boyds%20stocks%20are%20meticulously%20engineered,recommended%20to%20bed%20your%20action.",success,Glass Bed Rifle Gunstock | Boyds Hardwood Gunstocks,"Boyds stocks are meticulously engineered and machined from the most stable materials to maintain a free floated barrel, reducing the opportunity for collision.","How to Glass Bed Your Rifle, Why would you glass bed your rifle, glass bedding accuracy, glass bedding affordable stock, glass bedding stocks, glass bedding accessories, glass bedding aftermarket, glass bedding laser checkering, glass bedding laser engraving, glass bedding laser gripping",
"https://www.boydsgunstocks.com/#:~:text=Every%20Boyds%20gunstock%20is%20constructed,durability%20in%20all%20weather%20conditions.",success,Hardwood Gunstock Manufacturer | Boyds Hardwood Gunstocks,"Boyds uses top-grade hardwood to craft durable, long-lasting shotgun & rifle stocks for top-selling firearm brands, including custom options. Get yours today!","gunstock , firearm stocks, shotgun stocks for sale, gunstock, gunstocks, custom wood rifle stocks, shotgun stocks, military stocks, stock finder, aftermarket stocks, pistol stock, wooden stocks, rifle stocks, gun stock, rifle stock ",
https://www.boydgaming.com/,success,"Hotels, Casinos, & Shows | Boyd","Boyd showcases the best in hotels, casinos, restaurants, shows, and more at each of its locations nationwide.  Experience Life Rewarded and book your next vacation at BoydGaming.com today.  ","boyd gaming, boyd gaming corp, boyd gaming corporation, boyd gaming las vegas, boyd gaming site, boyd gaming website, boyd gaming home page, boyd gaming homepage, boyd gaming home",
"https://www.boydsgunstocks.com/content/resource-center/about-boyds#:~:text=Boyds%20continues%20to%20innovate.,to%20capture%20the%20public's%20attention.",success,About Boyds | Boyds Hardwood Gunstocks,No description,No keywords,
"https://www.boydsgunstocks.com/gallery#:~:text=All%20Boyds'%20RVT%20stocks%20come,Average%20weight%20of%202.3%20lbs.",success,"Gunstock Gallery Colors, Shapes, Engravings | Boyds Hardwood Gunstocks",No description,No keywords,
https://www.boydscoffeestore.com/whole-beanground.html,success,Boyds Shop All Categories,"For all you coffee lovers, Boyd's whole bean coffee and bulk ground coffee are just the ticket to keep you brewing throughout the day!",boyds | whole bean coffee | ground coffee | bulk coffee,
https://www.facebook.com/BoydsGunstocks/,success,Boyds Hardwood Gunstocks | Mitchell SD | Facebook,"Boyds Hardwood Gunstocks, Mitchell, South Dakota. 172,271 likes · 225 talking about this. American Craftsmen Preserving the Tradition
FACTORY...",No keywords,
https://www.boydsonestop.com/,success,Boyd's One Stop,"For decades, Boyd's One Stop has served the Galveston County and 
surrounding areas with the best local seafood products on the market. 
Weather its large wholesale orders, event catering, fishing equipment, 
tackle, fishing licenses, or a hot meal. Boyd's Seafood is the number 1 
supplier for wholesale crawfish in Texas. If you need a supplier for 
wholesale crawfish, shrimp, or crabs, give us a call.",No keywords,
https://www.amazon.com/boyds-bears/s?k=boyds+bears,success,Amazon.com : boyds bears,No description,No keywords,
https://www.tripadvisor.com/Tourism-g41015-Boyds_Montgomery_County_Maryland-Vacations.html,success,tripadvisor.com,No description,No keywords,
https://www.target.com/b/boyds-bears/-/N-yapbk,success,Boyds Bears : Target,"Shop Target for a wide assortment of Boyds Bears. Choose from Same Day Delivery, Drive Up or Order Pickup. Free standard shipping with $35 orders. Expect More. Pay Less.",Boyds Bears,
https://www.instagram.com/boydsphiladelphia/?hl=en,success,Boyds (@boydsphiladelphia) • Instagram photos and videos,"14K Followers, 191 Following, 799 Posts - Boyds (@boydsphiladelphia) on Instagram: ""The Family Retailer for Luxury Fashion.
#BoydsForLife""",No keywords,
http://www.boydshistory.org/,success,Home - BOYDS HISTORICAL SOCIETY,"Upcoming Events All events are at the Boyds Negro School unless otherwise listed February 18, 2024 - Open House 2:00-4:00 pm February 21, 2024 - Monthly Meeting 7:00 pm Our Mission The Boyds Historical Society (BHS) was organized in 1975 (as the Boyds/Clarksburg Historical Society). Our membership consists of local residents who share",No keywords,
https://www.ebay.com/b/Boyds-Stuffed-Animals/436/bn_1920434,success,Boyds Stuffed Animals for sale | eBay,Great deals on Boyds Stuffed Animals. Expand your options of fun home activities with the largest online selection at eBay.com. Fast & Free shipping on many items!,No keywords,
https://www.farmerbros.com/products/coffee/whole-bean-and-ground//boyds-coffee,success,Boyds Coffee,"Boyds Coffee, founded in Portland in 1912, roasts coffee with a passion for a rich, bold cup of coffee that will help you meet the challenges of your day.","Boyds, coffee, wholesale coffee, restaurant coffee, convenience store coffee",
https://www.facebook.com/boydsphiladelphia/,success,Boyds | Philadelphia PA | Facebook,"Boyds, Philadelphia, Pennsylvania. 7,471 likes · 83 talking about this · 3,331 were here. The Family Retailer for Luxury Fashion.",No keywords,
https://www.ebay.com/b/Boyds-Collectible-Sculptures-Figurines/261628/bn_16564287,success,Boyds Collectible Sculptures & Figurines for sale | eBay,Get the best deals on Boyds Collectible Sculptures & Figurines when you shop the largest online selection at eBay.com. Free shipping on many items | Browse your favorite brands | affordable prices.,No keywords,
https://www.boydsonestop.com/grill,success,Boyd's Cajun Grill — Boyd's One Stop,"Don't have time to make a meal? Come try some of our cooked crawfish or BBQ 
crabs. Boyd's Cajun Grill provides seafood caught fresh from the gulf. Stop 
by our restaurant today and try some of the best seafood in Texas City. All 
available at affordable prices.",No keywords,
https://en.wikipedia.org/wiki/Boyds_Bears,success,Boyds Bears - Wikipedia,No description,No keywords,
https://www.mapquest.com/us/maryland/boyds-md-283509022,success,"Boyds, MD Map & Directions - MapQuest","Get directions, maps, and traffic for Boyds, MD. Check flight prices and hotel availability for your visit.",No keywords,
https://www.visitphilly.com/things-to-do/attractions/boyds/,success,Boyds | Visit Philadelphia,"An iconic Philadelphia clothier, Boyds continues to offer the best designer fashion, shoes and accessories for men and women, with impeccable service and free valet parking.",No keywords,
https://www.midwayusa.com/boyds-stocks/b?bid=1025,success,Access Denied,No description,No keywords,
https://www.boydsretrocandy.com/,success,Childhood memories are made each day at...BOYD'S RETRO CANDY STORE,Childhood memories are made each day here at Boyd's Candy Store and we will help you find your favorite candy to mark any special occasion.,"Candy, Bulk Candy, Old Time Candy, Groovy Candy, Retro Candy, 50's Candy, 60's Candy, 70's Candy, 80's Candy, 90's Candy, Jelly Belly, Sky Bars, Black Jack Gum, Chuckles, French Chews, Gold Coins, Coconut and Fruit Slices, It's a Boy/Girl Items, Holiday Candies, International Candy, Gourmet Candy",
https://www.opticsplanet.com/boyds-hardwood-gunstocks-brand.html,success,403 - Forbidden,No description,No keywords,
https://www.youtube.com/user/boydsgunstocks,success,Boyds Hardwood Gunstocks - YouTube,Every Boyds gunstock is constructed of top-grade laminated hardwood that's dried to exacting specifications to ensure rigidity and stability. They are also s...,"gunstocks ""boyds gunstocks"" ""hardwood gunstocks"" ""replacement gunstocks""",
https://www.yelp.com/biz/boyds-hardwood-gunstocks-mitchell-2,success,"BOYDS HARDWOOD GUNSTOCKS - Updated July 2024 - 31 Photos & 73 Reviews - 25376 403rd Ave, Mitchell, South Dakota - Outdoor Gear - Phone Number - Yelp","73 reviews and 31 photos of BOYDS HARDWOOD GUNSTOCKS ""Bought a gun stock from them and am very happy with the work. The hardware that came with it did not fit but to me it was not a big deal. Overall everything was very pretty and fit we'll. I also appreciate how they have Different stocks for off brand firearms. Price is also reasonable.""",No keywords,
https://www.youtube.com/watch?v=y2kOm6hXgxE,success,Boyds Hardwood Gunstocks Product Showcase - Shot Show 2024!! - YouTube,"GEAR GIVEAWAY!!  I'm trying to Give Away ALL my gear!  To be eligible for my GEAR GIVEAWAY, join The Outer Limitless ""Inner Ring"" Patreon for EXCLUSIVE OPPOR...","video, sharing, camera phone, video phone, free, upload",
https://www.boydscampground.com/,success,Boyd's Key West RV Campground - Waterfront RV & Tent Camping,"Key West's premier waterfront RV and Tent camping destination since 1963. Featuring waterfront campsites, resort-style pool and Tiki lounge. Home of ",No keywords,
https://www.boyds.com/,success,boyds.com,Forsale Lander,No keywords,
https://boydgroup.com/,success,Home | The Boyd Group Services Inc.,Boyd Group Services Inc. (”BGSI”) is a Canadian corporation and controls the Boyd Group Inc. and its subsidiaries. BGSI shares trade on the Toront…,No keywords,
https://www.boydstire.com/,success,Boyd's Tire and Service | Auto Repair & Tire Shop in Central Ohio,"Boyd's Tire and Service is the local choice for auto repair and tires in Central Ohio,  delivering honest and professional services you can trust. Schedule your appointment with us today!",No keywords,
https://boydsbears.ca/,success,HOME » The Boyds Bears Shop,"The Bear Wear Pin Collection: They're Unique and Fun. Whether it's Christmas, a birthday or another special occasion, Add some spice to your wardrobe with a",No keywords,
https://www.boydsoutdoorpower.com/,success,Home,Experienced Power and Outdoor Equipment Dealership specializing in Zero Turn Mowers. Financing available. Call us to speak with a knowledgeable mower specialist today!,"mowers, power equipment, zero turn, outdoor products, new, financing, service, parts",
https://www.linkedin.com/company/boyd-consultants-ltd,success,Boyds | LinkedIn,No description,No keywords,
https://www.instagram.com/boydsgunstocks/,success,Boyds Hardwood Gunstocks (@boydsgunstocks) • Instagram photos and videos,"32K Followers, 124 Following, 2,937 Posts - Boyds Hardwood Gunstocks (@boydsgunstocks) on Instagram: ""💥 Hardwood Only
🎯 Enhanced Accuracy
👉 Order online 24/7
#betterwboyds #boydsgunstocks""",No keywords,
https://www.nyc.gov/site/dep/water/boyds-corner-reservoir.page,success,Boyds Corner Reservoir - DEP,No description,No keywords,
https://boydspecialtiesjerky.com/,success,Boyd Specialties – BOYD SPECIALTIES,No description,No keywords,
https://drboyds.com/,success,Dr. Boyd's Veterinary Resort | Rockville,"When you arrive at our Rockville resort, you can have the peace of mind knowing that your pet will immediately be under the direct supervision of our veterinary team.",No keywords,
https://www.boydgaming.com/locations,success,Boyd Locations | Boyd,"Learn more about the Boyd Casinos and Hotels, and the things to do at each location in Las Vegas, and Nationwide.",No keywords,
https://www.dcnr.pa.gov/StateParks/FindAPark/BoydBigTreePreserveConservationArea/Pages/default.aspx,success,Boyd Big Tree Preserve Conservation Area,No description,No keywords,
https://books.google.com/books?id=tOVFAQAAMAAJ&pg=PA49&lpg=PA49&dq=boyds&source=bl&ots=D5IlNlB8p0&sig=ACfU3U2Pirf-IxH3H2h4e_xxfBLj-aIkwg&hl=en&sa=X&ved=2ahUKEwiY2Mjd952HAxXUv4kEHYJ3Flw4KBDoAXoECCUQAw,success,The Boyds of Penkill and Trochrig: Their Ancestors and Descendants - Google Books,,No keywords,
https://books.google.com/books?id=Ltc4UA7w084C&pg=PP5&lpg=PP5&dq=boyds&source=bl&ots=0dzE2xbmUx&sig=ACfU3U1TQUusCO7BRoch2loW_Wz8_ow-9w&hl=en&sa=X&ved=2ahUKEwiY2Mjd952HAxXUv4kEHYJ3Flw4KBDoAXoECCYQAw,success,Boyds Tracker Resin Volume 2 - Google Books,"This book is the most complete and accurate guide of The Boyds Collection Ltd. in the world. A must have for the serious collector! The Boyds Collection Ltd.? began as an antiques shop in the home of G.M. Lowenthal and his partner (now wife), Justina Unger. Their love of antiques outweighed their ability to purchase many of the rare items, so the team shifted its focus. Instead of the true antiques, G.M. and Tina began to seek out and sell Antique Reproductions, with the look and feel of true antiques at more affordable prices. This retail venture proved to be so successful that by 1982 they began to wholesale some of these top-selling antique reproductions to other stores. The wholesale part of The Boyds Collection began to flourish and G.M. added a new line when he found a group of 100% Merino Wool Bears from China. In 1984 G.M. designed a 12 fully jointed wool bear and named it after his latest joint venture with Tina...their newborn son, Matthew. This becoming a beloved part of The Boyds Collection known far and wide as ?Boyds Bears?. Also in 1984, G.M. turned to resin sculpting to produce The Gnomes Homes, extremely detailed miniature houses based on American architecture and his own fertile imagination. In 1993, Boyds released its first series of resin figurines, The Bearstone Collection?, and followed that up with Folkstones?, DollstonesTM, and host of other wacky resin characters, villages, dolls, pottery, treasure boxes, and nifty home d?cor.",No keywords,
https://books.google.com/books?id=AZ35hPZ6g7YC&pg=PA207&lpg=PA207&dq=boyds&source=bl&ots=cs0cSiDyye&sig=ACfU3U0F161at3jTv-NFur-thdgVbZWFOA&hl=en&sa=X&ved=2ahUKEwiY2Mjd952HAxXUv4kEHYJ3Flw4KBDoAXoECCQQAw,success,The Boyds: A Family Biography - Brenda Niall - Google Books,"The Boyd family is Australia&#39;s most remarkable artistic dynasty. This work traces the emergence of an extraordinary artistic tradition. It places the Boyds in their historical and personal contexts, tells the interwoven stories of their brilliant careers, and analyses the shaping influences on their lives.",No keywords,
https://www.youtube.com/watch?v=ExFdJUwHIg8,success,"Boyds Gunstocks: “How To and Why You Would; Glass Bed Your Rifle"" - YouTube","When you fire your rifle, an upward motion of the barrel is createdwhich causes a pulling action on the stock. Dependent on the caliber,this can be quite vio...","bed your action, barreled action, glass bed your rifle, liquid Wrench, acraglas gel, bedding compound, zeroing your rifle, release agent, free float your barrel, accurizing your rifle, hardwood gunstocks, shooting sports, Hunting, boyds, rifle stocks, the naked truth, replacement stocks, replacement gunstocks, laminate gunstocks, firearm, gun, stock, How-to (Website Category), accuracy, accurizing a firearm",
https://montgomeryparks.org/parks-and-trails/boyds-local-park/,success,Boyds Local Park - Montgomery Parks,No description,No keywords,
https://thebarnatboydsmills.com/,success,Retreat Center in the Poconos: The Barn at Boyds Mills,Host your personal or group retreat in our center at the base of the Pocono Mountains in Pennsylvania. Event space is also available.,No keywords,
https://www.boydwine.com/store,success,Wine Store - Boyd Family Vineyards,,,
https://www.boydcorp.com/,success,Home - Boyd | Trusted Innovation,"Boyd is a world-leading innovator of engineered material and thermal management technologies to seal, cool, and protect our customers most critical applications. We gain unparalleled technology insight solving complex challenges across the leading industries we serve.",No keywords,
https://boydconsultants.com/,success,Boyds | Research and Drug Development Consultancy,"Boyds is a global drug development consultancy working with pharma, biotechs, spin-outs and academic groups to translate science into medicinal products and treatments for patients.",No keywords,
https://boydandwurthmann.com/,success,"Boyd & Wurthmann | Where the locals eat in Berlin, Ohio",No description,No keywords,
https://boydbros.com/,success,Boyd Bros,No description,No keywords,
https://www.boydspharm.com/,success,Welcome - Boyd's Pharmacy - Your Local Florence Pharmacy,Our pharmacy combines high quality products with personalized care. Our knowledgeable staff is happy to help you with any questions you may have. We strive to help you reach your health and wellness goals.,,
https://boydsofbedford.com/,success,Quality Goods & Apparel for Petrolheads / Boyds of Bedford,"UK-based independent brand inspired by all things petrol powered. Hand-printed, high quality clothing and products with focus on workwear durability coupled with design focus. Inspired by bikeriders, motorcycles, American classic car culture and life in the workshop.",No keywords,
https://boydcycling.com/,success,Boyd Cycling - The Handcrafted Revolution,"Boyd Cycling is a craft wheel manufacturer who specializes in high end wheels for road, gravel, cyclocross, and mountain bike. Wheels are all hand built in Greenville, SC and shipped throughout the world. 2017 and 2019 South Carolina Export business of the year.",No keywords,
https://www.boydbeef.com/,success,"Boyd Beef Cattle | Mays Lick, KY",,No keywords,
https://cpw.state.co.us/placestogo/parks/boydlake,success,Boyd Lake State Park,"This is the Boyd Lake State Park Homepage.  Located on the North End of Loveland,​​​​​​​​​​​​​​​​​Boyd Lake State Park has something for everyone: boating, fishing, camping, picnicking, swimmi​ng, hiking, biking, and hunting.","Boyd Lake State Park, Boyd Lake, Loveland, State Park, Boating, Fishing, Camping, Picnicking, Swimming, Hiking, Biking, Hunting",
https://www.gunbroker.com/c/m/boyds-gunstocks/,success,Just a moment...,No description,No keywords,
https://www.boydsequipment.com/,success,"BBQ Store, Farm & Ranch, Fireplace & Patio, Propane and more.. – Boyd's Equipment",The same family has owned and operated Boyd's Equipment for 82 years. We pride ourselves on taking care of our customers and maintaining our expertise in the products we sell. We want to make sure you have the best possible experience when shopping with us either in-store or online.,No keywords,
https://earbobsdc.com/products/boyds,success,Boyds – EarBobs DC,Lightweight and leafy,No keywords,
https://www.boydsports.com/,success,Boyd Sports | Sports.BoydGaming.com,No description,No keywords,
https://www.boydsstation.org/,success,Boyd's Station,"Boyd’s Station - a Kentucky nonprofit 501c(3) organization - offers 
emerging artists and student journalists a safe, inclusive, supportive 
space with the community of Harrison County for and with people from all 
ages, backgrounds and cultures to discuss, share, learn about and expand on 
the areas of literacy, communication and journalism through the visual arts 
and writing.",No keywords,
https://boydcoddingtonwheels.com/,success,Home - Boyd Coddington Wheels,Choose Your Style.....,No keywords,
https://www.boydcruwines.com/,success,Boyd Cru Wines,,No keywords,
https://www.boydsdirect.com/,success,"Graphic Design|Printing|Direct Mail|Advertising Specialties|Stoneham, MA Printer|Boyds Direct","Boyds Direct is a full service design, print and mail business focused on providing high ROI on business and marketing collateral.Focused on business, non-profit and political customers.",No keywords,
https://www.youtube.com/watch?v=kOnz3SVJZQ0,success,Boyds GunStocks Review - At One Stock Review | Options & Features - YouTube,"In this Boyds gun stock review we go over 4 different Boyds stocks that offer different features and looks.  The Boyds At-One Adjustable gun stock, along wit...","boyds at one stock review, adjustable gun stocks, boyds at-one rifle stock review, boyds featherweight thumbhole, boyds featherweight thumbhole stock review, boyds featherweight thumbhole stock weight, boyds featherweight thumbhole weight, boyds gunstocks at one reviews, boyds gunstocks review, boyds hardwood gunstocks review, boyds stock, at-one stock, adjustable stock, boyds at-one, boyds stock review, boyds stocks, boyds stocks ruger american, Boyds gunstocks",
https://astrapublishinghouse.com/imprints/astra-young-readers/,success,Astra Young Readers - Astra Publishing House,No description,No keywords,
https://books.google.com/books?id=RZZIAQAAMAAJ&pg=PA103&lpg=PA103&dq=boyds&source=bl&ots=tjOF59Ardf&sig=ACfU3U0xgrYJy4GC5BB6l1hPGykzYjvgAw&hl=en&sa=X&ved=2ahUKEwjk4crh952HAxXWv4kEHQYNA804RhDoAXoECB8QAw,success,"The Lost Ship and the Saved Tribe, Or, The Boyds and Their Kin and Other Poems - James Shields Boyd - Google Books",,No keywords,
https://boydmetals.com/,success,"Boyd Metals - Full service metal products in AR, MO, OK, and TX","Metal cut, formed, and delivered. Arkansas, Missouri, Oklahoma, and Texas, service centers carry a full line of high-quality metal products.",No keywords,
https://books.google.com/books?id=Tm8tAAAAYAAJ&pg=PA41&lpg=PA41&dq=boyds&source=bl&ots=xB5dcquGG_&sig=ACfU3U3JdA6x7rfchGamz38poNBLu604cg&hl=en&sa=X&ved=2ahUKEwjk4crh952HAxXWv4kEHQYNA804RhDoAXoECCEQAw,success,"History of the Boyd Family, and Descendants: With Historical Chapter of the ... - William Philip Boyd - Google Books",,No keywords,
https://books.google.com/books?id=Dq84ylaUlasC&pg=PA16&lpg=PA16&dq=boyds&source=bl&ots=OrPSlxTMmY&sig=ACfU3U26PJYBbNHWfaqrzlWofNoIaiDYRw&hl=en&sa=X&ved=2ahUKEwjk4crh952HAxXWv4kEHQYNA804RhDoAXoECCIQAw,success,"Catalogue of the John Boyd Thacher Collection of Incunabula - John Boyd Thacher, Library of Congress. John Boyd Thacher Collection - Google Books",,No keywords,
https://books.google.com/books?id=ON8HAAAAQAAJ&pg=PA23&lpg=PA23&dq=boyds&source=bl&ots=0SJDnD66Lq&sig=ACfU3U11PZNsV9s6NhWmjwGk4FbOJ5HQRw&hl=en&sa=X&ved=2ahUKEwjk4crh952HAxXWv4kEHQYNA804RhDoAXoECCMQAw,success,"History of dr. Boyd's fourth High school class, with biogr. sketch of dr. Boyd - James Colston - Google Books",,No keywords,
https://www.intelligence.gov/evolution-of-espionage/civil-war/confederate-espionage/belle-boyd,success,Access Denied,No description,No keywords,
https://books.google.com/books?id=S0QuAAAAYAAJ&pg=PA11&lpg=PA11&dq=boyds&source=bl&ots=oryUzCcBr1&sig=ACfU3U3FjZXVgyPxBO_c6_gcZJyMZaAunQ&hl=en&sa=X&ved=2ahUKEwjk4crh952HAxXWv4kEHQYNA804RhDoAXoECCAQAw,success,"Proceedings of the Trial of Hon. James Boyd, of Montgomery Co., Pa., June 14 ... - James Boyd - Google Books",,No keywords,
https://www.boydco.com/,success,"Boyd Equipment: Pressure Washer Equipment, Parts & Service","Boyd Equipment specializes in pressure washer & industrial cleaning equipment sales, parts and repair in Tucson, Phoenix, AZ and Albuquerque, NM. Contact us today for pricing.",No keywords,
https://boydlighting.com/,success,Modern Lighting | Architectural Lighting,Classic Modern Lighting solutions made from state of the art LED technology. Designer-Lighting manufacturer since 1921. Interior and Exterior Lighting,No keywords,
https://www.boydindustries.com/,success,Award-Winning Healthcare Operatory Equipment | Boyd Industries | SMR,"We are the leading manufacturer of healthcare operatory equipment for specialists around the world. Products include Examination/Surgery Chairs, Clinical Cabinets and accessories.",No keywords,
https://www.mta.maryland.gov/schedule/timetable/marc-brunswick,success,Timetable | MARC | BRUNSWICK - WASHINGTON | Maryland Transit Administration,No description,No keywords,
https://president.tennessee.edu/biography/randy-boyd/,success,Randy Boyd - Office of the President | University of Tennessee,No description,No keywords,
https://www.boydvacationshawaii.com/,success,Experience Vacations Hawaii,No description,No keywords,
https://boydisd.net/,success,Boyd ISD – Boyd Independent School District,No description,No keywords,
https://www.boydscustomcabinets.com/,success,"New Cabinets | Maple Grove, MN | Boyd's Custom Cabinets","Get custom cabinets installed in your home or business today with Boyd Custom cabinets in Maple Shade, MN. Call us today to get started.",No keywords,
https://www.boyds-implement.com/,success,"Home Boyd's Implement Service, LLC Tillamook, OR (877) 842-9408","Home Boyd's Implement Service, LLC Tillamook, OR (877) 842-9408","Home Boyd's Implement Service, LLC Tillamook, OR (877) 842-9408",
https://www.visitmaryland.org/listing/history-heritage/boyds-negro-school,success,Boyds Negro School | VisitMaryland.org,This one-room wooden schoolhouse served as the only public school for African Americans in Boyds from 1895 - 1936 and served grades 1 - 8. The school is open by appointment.,No keywords,
