link,status,title,description,keywords,error
https://en.wikipedia.org/wiki/Birdwatching,success,Birdwatching - Wikipedia,No description,No keywords,
"https://en.wikipedia.org/wiki/Birdwatching#:~:text=her%20husband%20goes%20this%20morning,auditory%20aspects%20of%20enjoying%20birds.",success,Birdwatching - Wikipedia,No description,No keywords,
"https://simple.wikipedia.org/wiki/Birdwatching#:~:text=Birdwatching%20or%20birding%20means%20going,of%20birds%20is%20called%20ornithology.",success,"Birdwatching - Simple English Wikipedia, the free encyclopedia",No description,No keywords,
"https://ornithology.com/birding-and-birdwatchers/#:~:text=So%20what%20is%20the%20difference,that's%20what%20they%20really%20are.",success,Birding and Birdwatchers - Ornithology,"Virtually everybody watches birds at times, but not everybody is a birdwatcher. There is no clear definition of this term coined in 1901, but if you actually watch birds with some interest, whether serious or casual, you are a birdwatcher.",No keywords,
https://www.massaudubon.org/places-to-explore/activities/birds-birding,success,Birds & Birding,"Despite its small size, Massachusetts regularly records over 300 different species of birds every year. Mass Audubon&#039;s wildlife sanctuaries offer excellent opportunities to see and learn more about the birds of Massachusetts, whether you&#039;re on a naturalist-guided walk or on your own with one of our bird checklists.",,
https://www.scientificamerican.com/article/we-are-in-the-golden-age-of-bird-watching/,success,We Are in the Golden Age of Bird-Watching | Scientific American,There has never been a better time to be or become a birder,No keywords,
https://www.audubon.org/birding,success,Birding | Audubon,From how to get started to what you need and where to go.,No keywords,
https://www.allaboutbirds.org/news/binoculars-and-beyond-nine-tips-for-beginning-bird-watchers/,success,Binoculars and Beyond: Nine Tips for Beginning Birdwatchers | All About Birds All About Birds,Originally published October 2011; updated December 2022. It's one of the first eye-openers for people who are just starting to pick up birdwatching: t ...,No keywords,
https://www.birdwatching.com/,success,"Birdwatching Dot Com - Binoculars, Scopes, and Birding Info",No description,No keywords,
https://ny.audubon.org/news/bird-watching-101-guide-beginners,success,Bird Watching 101: A Guide for Beginners | Audubon New York,A fun and rewarding pastime- here's how to get started birding!,No keywords,
https://www.nps.gov/articles/birding-for-beginners.htm,success,Birding For Beginners (U.S. National Park Service),No description,No keywords,
https://ebird.org/home,success,eBird - Discover a new world of birding...,"eBird transforms your bird sightings into science and conservation. Plan trips, find birds, track your lists, explore range maps and bird migration—all free.",No keywords,
https://www.cnn.com/cnn-underscored/outdoors/birdwatching-beginners-guide-ornithology,success,Access to this page has been denied,px-captcha,No keywords,
https://www.mass.gov/info-details/get-started-birding,success,Get started birding | Mass.gov,You don’t have to travel far to see wildlife and experience the outdoors! Bird watching is a fun way to relax and enjoy the nature that surrounds you.,No keywords,
https://www.youtube.com/watch?v=5gIPwFu4Wo8,success,The Joy of Birdwatching - Bird Academy - YouTube,Join us for our Joy of Birdwatching Course: https://academy.allaboutbirds.org/product/joy-of-birdwatching/The beauty of birds is all around us.  And once you...,"birds, birding, birdwatching, wellness, nature, mindfulness, bird feeder, bird feeding, feeder birds, birder, outdoors, earthday",
https://www.britannica.com/topic/bird-watching,success,"Bird-watching | Tips, Gear & Locations | Britannica","Bird-watching, the observation of live birds in their natural habitat, a popular pastime and scientific sport that developed almost entirely in the 20th century. In the 19th century almost all students of birds used guns and could identify an unfamiliar species only when its corpse was in their","bird-watching, encyclopedia, encyclopeadia, britannica, article",
http://www.birdingpal.org/ma.htm,success,Go birdwatching with a Birdingpal from Massachusetts.,No description,No keywords,
https://www.birds.com/activities/bird-watching/,success,Bird Watching - Birds.com,"Bird watching is the viewing of birds in their natural habitat in the wild, or in their improvised habitats in urban areas, possibly even in your own back",No keywords,
https://www.mass.gov/info-details/birdwatching-in-boston,success,Birdwatching in Boston | Mass.gov,"If you live in Boston, you don’t have to travel far outside the city to see wildlife and experience the outdoors!",No keywords,
https://www.nytimes.com/2022/12/10/well/move/bird-watching-health-benefits.html,success,The Health Benefits of Bird-Watching - The New York Times,Spending time outdoors with a pair of binoculars is good for your body and soul. The upcoming Audubon Christmas Bird Count is the perfect excuse to start.,No keywords,
https://www.alltrails.com/us/massachusetts/boston/birding,success,alltrails.com,No description,No keywords,
https://www.birdwatchingdaily.com/,success,BirdWatching,No description,No keywords,
https://www.youtube.com/watch?v=5CkfrN_U1iE,success,Bird Watching for Beginners - YouTube,"Watching a bird is easy, but seeing it up close, knowing what it is, and how to identify it is the hardest part. Yet also the most rewarding! Check out this ...","Bird Watching, Birding, Hamilton, Burlington, Ontario, Wild Birds, natural lands, nature sanctuaries, nature",
https://unity.edu/hybrid-learning/bird-watching-career/,success,Home Page - Unity Environmental University,"Unity Environmental University is committed to educating environmental professionals. We offer Bachelor's and Master's degrees, and online Courses.",No keywords,
https://birdinghotspots.org/region/US-MA,success,Birding in Massachusetts - Birding Hotspots,No description,No keywords,
https://www.alltrails.com/us/massachusetts/cambridge/birding,success,alltrails.com,No description,No keywords,
https://birda.org/how-to-start-birding-a-helpful-guide-for-birdwatching-beginners/,success,How To Start Birdwatching For Beginners | Birda,"Read our helpful guide for beginners looking to start birdwatching, including the first 7 steps you can take today, from field guides, to apps and more.",No keywords,
https://www.vox.com/even-better/23641271/beginners-guide-bird-watching-birding,success,How to start bird-watching when you have no idea where to go - Vox,"No, you don’t need a fancy pair of binoculars to get into bird-watching, according to avid birders.",No keywords,
https://oceanservice.noaa.gov/ecosystems/estuaries/bird-watching.html,success,Celebrate the Valor and Value of the Nation’s Birds,"Each year, over 45 million Americans take part in bird watching, spending approximately $41 billion on related trips and equipment—contributing significantly to local communities and the national economy as a whole.", ,
https://www.newyorker.com/books/page-turner/the-difference-between-bird-watching-and-birding,success,The Difference Between Bird Watching and Birding | The New Yorker,"Birding is the opposite of being at the movies—you’re outside, not sitting in a windowless box; you’re stalking wild animals, not looking at pictures…","birds,birdwatching",
https://www.cambridgema.gov/steam/steamathomeactivities/Backyard-Birding,success,Backyard Birding,No description,No keywords,
https://www.merriam-webster.com/dictionary/bird-watch,success,Bird-watch Definition & Meaning - Merriam-Webster,The meaning of BIRD-WATCH is bird.,No keywords,
https://www.youtube.com/channel/UCuL60_Ko4m9xCaa4QDNgJrw,success,Bird Watching HQ - YouTube,"My name is Scott and my goal is simple:I want to connect people to nature by inspiring you to attract more birds, animals, and wildlife to your yard.First, m...","birds ""bird watching"" ""bird feeding"" ""live animal cam"" ""live bird cams"" ""live bird feeders"" animals",
https://www.nps.gov/pinn/planyourvisit/bird-watching.htm,success,Bird Watching - Pinnacles National Park (U.S. National Park Service),No description,No keywords,
https://www.wired.com/story/best-bird-watching-gear/,success,Best Bird Watching Gear (2024): Everything You Need to Start Birding | WIRED,"Whether you want to call yourself a birder, bird-watcher, or twitcher, here’s everything you need to get started with this peaceful pastime.","shopping,outdoors,buying guides,nature,birds,outdoor activities",
https://birdsconnectsea.org/get-involved/go-birding/,success,Go Birding - Birds Connect Seattle,No description,No keywords,
https://www.visitflorida.com/travel-ideas/articles/outdoors-nature-florida-bird-watching-birding-trail/,success,Great Spots for Bird Watching in Florida,Florida is considered one of the best places in the world for bird watching. Here are some of the top birding spots in the Sunshine State.,No keywords,
https://www.capecodchamber.org/things-to-do/outdoor-and-water-activities/birdwatching/,success,Birdwatching on Cape Cod | Cape Cod Bird Club,Cape Cod s bird watching has diverse habitats and geography that make our destination perfect for watching migratory birds during the spring and fall.,No keywords,
https://www.explorecochise.com/bird-watching/,success,Bird Watching | Explore Cochise,No description,No keywords,
https://www.fws.gov/story/birding,success,Birding | U.S. Fish & Wildlife Service,"From bald eagles to spoonbills, from condors to puffins, birds abound on national wildlife refuges. Refuges provide places for birds to nest, rest, feed and breed. Refuges conserve bird habitat and help bird species survive. No wonder refuges are some of America’s birdiest places. Where the Birds Are Whether you’re an experienced birder or a newbie, there’s a wildlife refuge for you. 10 Birds to See",No keywords,
https://www.wild-bird-watching.com/,success,Bird Watching - Learn The Habits of Our Backyard Birds,No description,No keywords,
https://visitmaine.com/things-to-do/wildlife-watching/bird-watching,success,Bird Watching - Visit Maine,Maine's wide diversity of coastal and inland habitats offers birders a variety of unique bird watching opportunities.,"Maine, birders, unique bird watching, atlantic puffuin, east coast, nesting, breeding ground, loons, spring, summer, puffuin.",
http://vtfishandwildlife.com/watch-wildlife/bird-watching/getting-started-birding,success,Getting Started Birding | Vermont Fish & Wildlife Department,"Everything you need to get started in birding, from where and when to go, to information on joining a birding group.",No keywords,
https://www.visitphoenix.com/sonoran-desert/learn/plants-animals/birding/,success,Bird Watching in Phoenix | Find Birding Spots in Arizona,"Enjoy some of the top bird watching spots in Phoenix, including places like the Phoenix Zoo, Desert Botanical Garden, and the Tres Rios Wetlands.",No keywords,
https://visitadirondacks.com/recreation/birding,success,Birding & Bird Watching in Upstate New York - See 100+ Species,"Find information on places to see a variety of bird species from eagles to loons, across the Adirondack region’s lakes, rivers and nature paths.",No keywords,
https://visit.sierravistaaz.gov/outdoor-adventure/birds-wildlife-watching,success,Access Denied,No description,No keywords,
https://boise.wbu.com/bird_watch,success,Wild Birds Unlimited - Nature Shop,"At Wild Birds Unlimited, we are trained to show you how to turn your yard into a birdfeeding habitat that not only brings song, color and life to your home, but also benefits the wild birds and the environment in your area. Based on years of research and experience, we have designed our products to be the highest quality birdfeeders and birdfeeding equipment on the market today.","back yard, backyard, bird bath, bird feeder, bird feeders, bird feeding, bird food, bird house, bird houses, bird seed, bird store, bird watching, bird, birdbath, birdfeeder, birdfeeders, birdfeeding, birdfood, birdhouse, birdhouses, birding, birds unlimited, birds, birdseed, birdwatching, feeder, feeders, franchise, franchising, gifts, nature gifts, nature shop, nature store, nesting, optics, retail, seed, squirrel, squirrels, suet, wbu, wild bird, wild birds unlimited, wild birds, wild life, wild, wildbirds, wildlife",
https://www.discovernewport.org/things-to-do/outdoor-recreation/bird-watching/,success,"Newport RI Bird Watching | Nature Trails, Bird Sanctuaries + Parks","With over 300 species of birds in Newport and Bristol County, Rhode Island, you'll want to add our area on your ""must visit"" list. Best places for bird watching include the Norman Bird Sanctuary, nature trails and parks!",No keywords,
https://www.centralparknyc.org/activities/guides/birding,success,Birding Guide | Central Park Conservancy,Interested in birdwatching? Learn how to respectfully spot the more than 210 bird species that make an appearance in Central Park.,"central, park, birds, looking, species, birding, bird, welcomes, berries, stop, home, it's, making, life, year",
https://www.visithoustontexas.com/aroundhouston/experiences/birding/,success,Bird Watching in Houston | Best Spots for Birding & Migration Info,"If you like watching birds, Houston is the perfect destination in the fall. Find the best places to watch all kinds of birds migrate to warmer weather around Houston.",No keywords,
https://www.brooklinebirdclub.org/,success,Home - Brookline Bird Club,No description,No keywords,
https://www.outerbanks.org/things-to-do/land-activities/birdwatching/,success,Outer Banks Bird Watching | Parks & Nature Preserves,"Situated along major migratory paths, the Outer Banks is a great place to see an incredible variety of birds. Learn more about when and where to go birding.",No keywords,
https://www.visithowardcounty.com/things-to-do/outdoors/wildlife/bird-watching/,success,Bird Watching,No description,No keywords,
https://www.happiness.com/magazine/art-culture-leisure/mental-health-benefits-of-bird-watching/,success,Beautiful Birding: 7 Mental Health Benefits of Bird Watching | happiness.com,"The mindful nature of bird watching makes it a healing hobby. From reduced stress to moments of awe, discover 7 key mental health benefits of bird watching.",mental health benefits of bird watching,
https://www.gatlinburg.com/things-to-do/outdoor-activities/bird-watching/,success,"Bird Watching | Gatlinburg, TN","The elevations & diverse topography makes the Smokies a great place for bird watching. The park is home to 120 species, so don't forget your binoculars!",No keywords,
https://www.visitknoxville.com/things-to-do/outdoors/birding/,success,Birding in Knoxville | Bird Watching in Eastern Tennessee,"Home to the only birding park in the state of Tennessee, come to Knoxville to glimpse an incredible variety of bird species, especially during migration season.",No keywords,
https://www.japan.travel/en/guide/bird-watching-japan/,success,Bird-Watching in Japan | Guide | Travel Japan - Japan National Tourism Organization (Official Site),"Bird watching or birding, is popular in Japan. See the iconic red-crowned crane, or tancho; Izu thrush, Pryer's woodpecker and the elusive Okinawa rail.",Story & Guide,
https://discoversouthcarolina.com/articles/ten-places-every-bird-lover-should-visit,success,Ten Places Every Bird Lover Should Visit,"Pack up your spotting scope and field guide because South Carolina has ten bird watching spots you don't want to miss. From the mountains to the coast, there's no shortage of rich preservations teeming with hundreds of species of birds.","outdoor activities & recreation, outdoor",
https://www.visitmaryland.org/list/top-spots-nature-watching-and-birding,success,Top Spots for Nature Watching and Birding | VisitMaryland.org,"Learn where the best places to go nature and bird-watching are in Maryland, from Point Lookout State Park to the Patuxent Wildlife Refuge.",No keywords,
https://www.arkansas.com/things-to-do/outdoors/bird-watching-wildlife,success,Bird Watching & Wildlife | Arkansas.com,"Exciting opportunities for birding and wildlife observation are found within easy reach of every Arkansas community. The success of habitat preservation efforts in The Natural State is evident in several populations of wildlife and birds, including the endangered Red-cockaded Woodpecker, herds of elk along the Buffalo National River, and American black bears across the state.",No keywords,
https://www.discoverlancaster.com/things-to-do/outdoor/birding/,success,"Bird Watching in Lancaster, PA | Birding | Discover Lancaster",Lancaster County is home to many excellent bird watching locations including Brunner Island and Holtwood Environmental Preserve. Find a detailed list of the best local birding spots here.,"places, lancaster, watch, birding, birds",
https://www.visittucson.org/things-to-do/outdoors/wildlife-viewing/bird-watching/,success,Bird Watching | Birding Guides & Locations | Visit Tucson,"The deserts of Tucson are home to over 500 species of birds, and hundreds that pass through during migration. Find birding links, guides, and locations.",No keywords,
https://www.discoverwildlife.com/how-to/watch-wildlife/bird-watching-in-your-garden,success,Watching the birds in your garden - Discover Wildlife,No description,No keywords,
https://www.visitcumberlandvalley.com/outdoor/parks-and-wildlife-area/bird-watching/,success,Cumberland Valley Bird Watching | Outdoors & Wildlife,Cumberland Valley has great parks for bird watching. Visit Waggoner's Gap to find different bird species and migratory hawks. View all listings here.,No keywords,
https://www.bellingham.org/bird-watching,success,Whatcom County Host Six of the Best Birding Sites On the Audubon List,"Whatcom County is a hotspot for bird watching enthusiasts. Home to hundreds of different bird species highlighting waterfowl and birds of prey, this area offers hours of bird watching enjoyment.",No keywords,
https://www.anchorage.net/outdoors/wildlife-viewing/birdwatching/,success,Bird-watching in Anchorage | Visit Anchorage,"Thousands of species of birds call Anchorage home or stopover during massive migrations from around the globe. Anchorage shores, ponds and lakes play host.",No keywords,
https://www.aba.org/,success,American Birding Association - American Birding Association,No description,No keywords,
https://www.birdsandblooms.com/birding/birding-basics/birding-health/,success,Boost Your Mental Health With Bird-watching - Birds and Blooms,Learn about the science behind why observing backyard birds supports your mental health and creates a needed reset from daily demands.,benefits of bird watching,
https://www.utah.com/things-to-do/outdoor-recreation/wildlife-viewing/birds-of-utah/,success,Bird Watching | Utah.com,"Utah birds consist of over 250 species, and can be spotted year-round. Learn more about birds of Utah by area.",No keywords,
https://sauvieisland.org/visitor-information/bird-watching/,success,Bird-Watching – sauvieisland.org,No description,No keywords,
https://visitcherokeenc.com/play/outdoor-adventure/birding/,success,Birding | Visit Cherokee NC,"Delight in birdwatching opportunities in Cherokee, NC.",No keywords,
https://www.visitlakecounty.org/birdwatching,success,Attention Required! | Cloudflare,No description,No keywords,
https://www.floridastateparks.org/learn/beginners-guide-birding,success,Beginner's Guide to Birding | Florida State Parks,"Bird-watching is a great way to learn about the environment. Birds can be seen from just about anywhere – your office window or even your front door. However, state parks and green spaces provide the greatest opportunity. Here are some beginner-friendly tips to help you keep track of your avian encounters.",No keywords,
https://www.travelwisconsin.com/things-to-do/outdoors/birding,success,Wisconsin Birding & Bird Watching | Travel Wisconsin,"With more than 300 wildlife areas, environmental centers and birding trails, Wisconsin is a haven for bird watchers and avian enthusiasts.","wisconsin birding, wisconsin bird watching, birding wisconsin, birding in wisconsin",
https://www.klamathbirdingtrails.com/,success,Home - Klamath Basin Birding Trails,No description,No keywords,
https://njaudubon.org/gobirding/,success,Let's Go Birding | New Jersey Audubon,No description,No keywords,
https://www.drytortugas.com/birding/,success,Dry Tortugas Birding | Dry Tortugas Bird Watching,Are you a bird watcher searching for exotic species? Take a Dry Tortugas Birding Trip and experience the best part of the Great Florida Birding Trail.,No keywords,
https://dcist.com/story/23/05/16/bird-watching-dc-region-spring-summer/,success,Where To Bird Watch In The DC Region This Spring,"Whether you're a more casual birder or a seasoned pro, the D.C. region is ripe with feathered friends this time of year.",No keywords,
https://www.sandiego.org/explore/things-to-do/tours-sightseeing/bird-watching.aspx,success,Bird Watching - The Official Travel Resource for the San Diego Region,,"Bird Watching, Tours & Sightseeing",
https://www.visithersheyharrisburg.org/trails/adventure-trail/bird-watching/,success,Discover places to go birding in the Hershey Harrisburg region,No description,No keywords,
https://www.exploreasheville.com/stories/post/8-places-to-bird-watch-asheville/,success,"8 Places to Spot Native Bird Species | Asheville, N.C.","Asheville, North Carolina is a bird-lovers paradise. Explore the native bird species at Asheville's bird watching havens: Beaver Lake, Douglas Falls, Chimney Rock, Craven Gap, Max Patch, Mount Mitchell, Mount Pisgah and the North Carolina Arboretum.",No keywords,
https://birdtrail.outdoornebraska.gov/,success,Nebraska Birding Guide,The Nebraska Birding Guide highlights Nebraska's diverse habitat types and the iconic bird species who live there. Discover Nebraska's notable bird species and top birding sites.,"bird, nebraska, guide, trail, birding, birds",
https://olympicpeninsula.org/drive-the-loop/birding/,success,Best Birdwatching Spots & Destinations | The Olympic Peninsula,"Discover the best birdwatching spots on the Olympic Peninsula — From the Hoh Rain Forest & Forks to Kalaloch Creek & Lake Quinault, see over 300 species!",No keywords,
https://visitcadelta.com/what-to-do/bird-watching/,success,Bird Watching - Visit the California Delta,No description,No keywords,
https://www.discovermoab.com/bird-watching/,success,"Bird Watching In and Around Moab, Utah.","Bird watching in Moab, Utah is a natural setting for birds that are unique to the Southwest, offering wetlands, canyons and high nesting area for birds whose habitats change with the seasons. Moab offers numerous picturesque locations for birding.",No keywords,
https://www.fws.gov/story/find-your-birding-community,success,Find Your Birding Community | U.S. Fish & Wildlife Service,Birdwatching doesn’t have to be a solo activity. Connecting with others who share your fascination with birds can boost your fun and expand your knowledge more quickly. Where can you find other birders — or aspiring birders? Here are some suggestions.,No keywords,
https://www.allaboutbirds.org/news/a-third-of-american-adults-are-birdwatchers-according-to-nationwide-survey/,success,"A Third of American Adults Are Birdwatchers, According to Nationwide Survey | All About Birds All About Birds","From the Winter 2024 issue of Living Bird magazine. Subscribe now. Photo by Alli Smith. Around 96 million people in the U.S. closely observed, fed, or photo ...",No keywords,
https://mtaudubon.org/birding-montana/,success,Birding Hotspots | Montana Audubon,Montana Birdwatching Hotspots Montana Audubon's Chapters have put out “birding hotspots” maps for certain locations in the state. Below you can access the current hotspots publications or websites: Bozeman Area Birding Hotspots of the Gallatin Valley (2014 edition) Helena Area NEW in 2015! Birding in the Helena Area Birds of the Canyon Ferry Wildlife Management,No keywords,
https://www.visitftcollins.com/things-to-do/outdoors/birdwatching/,success,Birding | Visit Fort Collins,"Fort Collins is a hotbed for birders, boasting nearly 500 recorded species. Fort Collins is a birder's paradise as it offers exceptional opportunities to view many of these birds thanks to 44 protected Natural Areas encompassing more than 41,000 acres and 114 miles of trails. Not to mention, with free birding excursions, you can spot birds year-round.",No keywords,
https://bearlake.org/cat/bird-watching/,success,Bear Lake Bird Watching Bear Lake Bird Refuge Idaho,"Bear Lake has over 1,760 acres of marsh, open water and grasslands have been dedicated to preserving bird and wildlife habitats. Bird watching for birders!",No keywords,
https://books.google.com/books?id=fU1KAAAAQBAJ&pg=PR6&lpg=PR6&dq=bird+watching&source=bl&ots=ZTRpXTXaG2&sig=ACfU3U3xd-JAxgT_saMha5RLEO6WZ6oDOw&hl=en&sa=X&ved=2ahUKEwilv9y9xp2HAxXa4zQHHRXuDAA4WhDoAXoECCAQAw,success,The Bird Watching Answer Book: Everything You Need to Know to Enjoy Birds in ... - Laura Erickson - Google Books,"How many feathers does a bird have? Do birds sleep while in flight? Why do Blue-Footed Boobies have blue feet? How do migrating birds know where to go and how to get there? For these and hundreds of other questions, The Bird Watching Answer Book has expert answers. Written by Laura Erickson, science editor at the Cornell Lab of Ornithology, this book is the authoritative source for information on birds of all kinds. ",No keywords,
https://www.smithsonianmag.com/history/how-bird-collecting-evolved-into-bird-watching-180980506/,success,How Bird Collecting Evolved Into Bird-Watching | Smithsonian,"In the early 1900s, newfound empathy for avian creatures helped wildlife observation displace dispassionate killing",,
https://www.alltrails.com/us/massachusetts/birding,success,alltrails.com,No description,No keywords,
