link,status,title,description,keywords,error
https://www.efboyd.com/,success,"E.F. Boyd & Son, Inc. | Cleveland OH funeral home and cremation Warrensville Heights OH funeral home and cremation",,"E.F. Boyd & Son, Inc., funeral home, funeral home in Cleveland OH, funeral services, traditional funeral service, cremation, embalming, caskets, urns, funeral flowers, pre-need, funeral arrangement, funeral pre-arrangement, funeral planning",
https://moco360.media/2024/07/02/county-police-investigate-death-of-boyds-man/,success,County police investigate death of Boyds man | MoCo360,No description,No keywords,
https://www.boyd.kyschools.us/,success,Home - Boyd County Public Schools District,Home - Boyd County Public Schools District  ,"Home, Boyd County Public Schools District  ",
https://www.boydlawgroup.com/,success,Boyd Richards Parker & Colonnelli Defense Law Firm,"The Attorneys at Boyd Richards Parker Colonnelli have the legal expertise, experience and knowledge to guide our clients.",No keywords,
https://www.boydandcharlies.com/,success,Just a moment...,No description,No keywords,
https://www.zillow.com/boyds-md/,success,Access to this page has been denied,px-captcha,No keywords,
https://boydinsurance.com/,success,Boyd Insurance - The Best Bradenton Insurance,Protecting what matters most with Boyd Insurance - your trusted choice for Bradenton insurance solutions. Get peace of mind today!,No keywords,
https://www.stlouis-mo.gov/government/departments/aldermen/representation/profile.cfm?id=1518,success,Alderman Pamela Boyd,No description,No keywords,
https://books.google.com/books?id=Ltc4UA7w084C&pg=PA4&lpg=PA4&dq=boyds&source=bl&ots=0dzE2xbmYp&sig=ACfU3U2wEaV_1iMsHved_VDTZL68msxPnQ&hl=en&sa=X&ved=2ahUKEwja2IHt952HAxWXtokEHWd1Bd84HhDoAXoECB0QAw,success,Boyds Tracker Resin Volume 2 - Google Books,"This book is the most complete and accurate guide of The Boyds Collection Ltd. in the world. A must have for the serious collector! The Boyds Collection Ltd.? began as an antiques shop in the home of G.M. Lowenthal and his partner (now wife), Justina Unger. Their love of antiques outweighed their ability to purchase many of the rare items, so the team shifted its focus. Instead of the true antiques, G.M. and Tina began to seek out and sell Antique Reproductions, with the look and feel of true antiques at more affordable prices. This retail venture proved to be so successful that by 1982 they began to wholesale some of these top-selling antique reproductions to other stores. The wholesale part of The Boyds Collection began to flourish and G.M. added a new line when he found a group of 100% Merino Wool Bears from China. In 1984 G.M. designed a 12 fully jointed wool bear and named it after his latest joint venture with Tina...their newborn son, Matthew. This becoming a beloved part of The Boyds Collection known far and wide as ?Boyds Bears?. Also in 1984, G.M. turned to resin sculpting to produce The Gnomes Homes, extremely detailed miniature houses based on American architecture and his own fertile imagination. In 1993, Boyds released its first series of resin figurines, The Bearstone Collection?, and followed that up with Folkstones?, DollstonesTM, and host of other wacky resin characters, villages, dolls, pottery, treasure boxes, and nifty home d?cor.",No keywords,
https://books.google.com/books?id=AZ35hPZ6g7YC&pg=PA426&lpg=PA426&dq=boyds&source=bl&ots=cs0cSiDyC6&sig=ACfU3U2tj5FImYp3okspcyFbF64pybIvvA&hl=en&sa=X&ved=2ahUKEwja2IHt952HAxWXtokEHWd1Bd84HhDoAXoECBsQAw,success,The Boyds: A Family Biography - Brenda Niall - Google Books,"The Boyd family is Australia&#39;s most remarkable artistic dynasty. This work traces the emergence of an extraordinary artistic tradition. It places the Boyds in their historical and personal contexts, tells the interwoven stories of their brilliant careers, and analyses the shaping influences on their lives.",No keywords,
https://boydaluminum.com/,success,Commercial Windows and Doors & Aluminum Window Replacement | Boyd,"Boyd builds commercial windows and doors, specializing in all areas of commercial windows aluminum including aluminum window replacement.",No keywords,
https://books.google.com/books?id=tOVFAQAAMAAJ&pg=PA6&lpg=PA6&dq=boyds&source=bl&ots=D5IlNlB8tU&sig=ACfU3U0ktQMJDCKURRRftqjLFzHUxlLfmg&hl=en&sa=X&ved=2ahUKEwja2IHt952HAxWXtokEHWd1Bd84HhDoAXoECB4QAw,success,The Boyds of Penkill and Trochrig: Their Ancestors and Descendants - Google Books,No description,No keywords,
